{
  "draft_id": "reqdraft_sample001",
  "draft_version": 1,
  "organization_id": null,
  "title": "招聘流程梳理与模板建设",
  "category": "人力资源",
  "background": "团队正在扩张，但当前招聘流程不统一。",
  "goal": "形成可重复执行的招聘流程和标准模板。",
  "target_audience": "企业招聘负责人和面试官",
  "use_scenario": "社会招聘和关键岗位招聘",
  "service_scope": ["梳理现有流程", "设计标准流程", "输出模板"],
  "exclusions": ["不包含招聘系统开发"],
  "risks": [],
  "dependencies": ["甲方提供现有招聘资料"],
  "budget_min": null,
  "budget_max": null,
  "currency": "CNY",
  "schedule": {"kind": "undecided"},
  "visibility": null,
  "invite_limit": null,
  "confidentiality_level": null,
  "deliverables": [{"name": "招聘流程手册", "format": "DOCX", "required": true}],
  "acceptance_criteria": ["覆盖从需求确认到录用审批的完整流程"],
  "attachments": [],
  "missing_fields": ["organization_id", "budget_min", "budget_max", "schedule", "visibility", "invite_limit", "confidentiality_level"],
  "change_summary": "由开小花根据用户描述生成的首版草稿"
}
